[
  {
    "id": "cs:https://www.cs.princeton.edu/events/mike-wong-will-present-his-fpo-finding-needle-haystack-application-aware-data-systems",
    "guid": "https://www.cs.princeton.edu/events/mike-wong-will-present-his-fpo-finding-needle-haystack-application-aware-data-systems",
    "sources": [
      "cs"
    ],
    "platform": "drupal-events-rss",
    "startsAt": "2026-10-20T14:00:00Z",
    "endsAt": "2026-10-20T16:00:00Z",
    "startTime": "2026-10-20T10:00:00",
    "endTime": "2026-10-20T12:00:00",
    "timezone": "America/New_York",
    "title": "Mike Wong will present his FPO \"FINDING THE NEEDLE IN THE HAYSTACK: APPLICATION-AWARE DATA SYSTEMS FOR EFFICIENT AI INFERENCE\" on 10/20/26 in Friend 108 at 10am.",
    "speakers": [
      {
        "name": "Mike Wong",
        "affiliation": ""
      }
    ],
    "speaker": "Mike Wong",
    "affiliation": "",
    "series": "",
    "tags": [],
    "purposes": [
      "engineering-newsletter"
    ],
    "rawCategories": [],
    "unmappedTags": [],
    "location": {
      "name": "Friend Center",
      "id": "",
      "detail": "108"
    },
    "urlRef": "https://www.cs.princeton.edu/events/mike-wong-will-present-his-fpo-finding-needle-haystack-application-aware-data-systems",
    "content": "",
    "rawEventDetails": "",
    "rawExtractAbstract": "",
    "rawExtractBio": "",
    "cancelled": "",
    "bannerImage": "",
    "itemType": "advertisement",
    "summaryRaw": "Mike Wong will present his FPO \"FINDING THE NEEDLE IN THE HAYSTACK: APPLICATION-AWARE DATA SYSTEMS FOR EFFICIENT AI INFERENCE\" on 10/20/26 in Friend 108 at 10am.",
    "locationRaw": "Friend Center 108",
    "mappingRules": [
      "cs:summary-is-title"
    ],
    "locationRule": "unambiguous_room",
    "summaryRest": "",
    "titleSource": "ics",
    "titleIsPlaceholder": false,
    "mappingConflict": false
  },
  {
    "id": "cs:https://www.cs.princeton.edu/events/cos-gender-sexuality-resource-center-mixer",
    "guid": "https://www.cs.princeton.edu/events/cos-gender-sexuality-resource-center-mixer",
    "sources": [
      "cs"
    ],
    "platform": "drupal-events-rss",
    "startsAt": "2026-10-27T20:00:00Z",
    "endsAt": "2026-10-27T21:00:00Z",
    "startTime": "2026-10-27T16:00:00",
    "endTime": "2026-10-27T17:00:00",
    "timezone": "America/New_York",
    "title": "COS & Gender Sexuality Resource Center Mixer",
    "speakers": [],
    "speaker": "",
    "affiliation": "",
    "series": "Climate & Inclusion",
    "tags": [],
    "purposes": [
      "engineering-newsletter"
    ],
    "rawCategories": [],
    "unmappedTags": [],
    "location": {
      "name": "Computer Science Tea Room",
      "id": "",
      "detail": ""
    },
    "urlRef": "https://www.cs.princeton.edu/events/cos-gender-sexuality-resource-center-mixer",
    "content": "",
    "rawEventDetails": "",
    "rawExtractAbstract": "",
    "rawExtractBio": "",
    "cancelled": "",
    "bannerImage": "",
    "itemType": "advertisement",
    "summaryRaw": "COS & Gender Sexuality Resource Center Mixer",
    "locationRaw": "Computer Science Tea Room",
    "mappingRules": [
      "cs:summary-is-title"
    ],
    "locationRule": "whole",
    "summaryRest": "",
    "titleSource": "ics",
    "titleIsPlaceholder": false,
    "mappingConflict": false
  },
  {
    "id": "cs:https://www.cs.princeton.edu/events/princeton-societal-ai-psai",
    "guid": "https://www.cs.princeton.edu/events/princeton-societal-ai-psai",
    "sources": [
      "cs"
    ],
    "platform": "drupal-events-rss",
    "startsAt": "2026-11-02T17:00:00Z",
    "endsAt": "2026-11-02T23:30:00Z",
    "startTime": "2026-11-02T12:00:00",
    "endTime": "2026-11-02T18:30:00",
    "timezone": "America/New_York",
    "title": "Princeton Societal AI (PSAI)",
    "speakers": [],
    "speaker": "",
    "affiliation": "",
    "series": "Princeton Societal AI (PSAI)",
    "tags": [],
    "purposes": [
      "engineering-newsletter"
    ],
    "rawCategories": [],
    "unmappedTags": [],
    "location": {
      "name": "",
      "id": "",
      "detail": ""
    },
    "urlRef": "https://www.cs.princeton.edu/events/princeton-societal-ai-psai",
    "content": "",
    "rawEventDetails": "",
    "rawExtractAbstract": "",
    "rawExtractBio": "",
    "cancelled": "",
    "bannerImage": "",
    "itemType": "advertisement",
    "summaryRaw": "Princeton Societal AI (PSAI)",
    "locationRaw": "",
    "mappingRules": [
      "cs:summary-is-title"
    ],
    "locationRule": "declined",
    "summaryRest": "",
    "titleSource": "ics",
    "titleIsPlaceholder": false,
    "mappingConflict": false
  },
  {
    "id": "cs:https://www.cs.princeton.edu/events/arabian-nights-tales-ai-science-and-trouble",
    "guid": "https://www.cs.princeton.edu/events/arabian-nights-tales-ai-science-and-trouble",
    "sources": [
      "cs"
    ],
    "platform": "drupal-events-rss",
    "startsAt": "2026-11-03T17:10:00Z",
    "endsAt": "2026-11-03T18:10:00Z",
    "startTime": "2026-11-03T12:10:00",
    "endTime": "2026-11-03T13:10:00",
    "timezone": "America/New_York",
    "title": "Arabian Nights: Tales of AI, Science, and Trouble",
    "speakers": [
      {
        "name": "Nihar Shah",
        "affiliation": "Carnegie Mellon University"
      }
    ],
    "speaker": "Nihar Shah, Carnegie Mellon University",
    "affiliation": "Carnegie Mellon University",
    "series": "",
    "tags": [],
    "purposes": [
      "engineering-newsletter"
    ],
    "rawCategories": [],
    "unmappedTags": [],
    "location": {
      "name": "Computer Science Small Auditorium",
      "id": "",
      "detail": "Room 105"
    },
    "urlRef": "https://www.cs.princeton.edu/events/arabian-nights-tales-ai-science-and-trouble",
    "content": "",
    "rawEventDetails": "",
    "rawExtractAbstract": "",
    "rawExtractBio": "",
    "cancelled": "",
    "bannerImage": "",
    "itemType": "advertisement",
    "summaryRaw": "Arabian Nights: Tales of AI, Science, and Trouble",
    "locationRaw": "Computer Science Small Auditorium (Room 105)",
    "mappingRules": [
      "cs:summary-is-title"
    ],
    "locationRule": "parenthetical",
    "summaryRest": "",
    "titleSource": "ics",
    "titleIsPlaceholder": false,
    "mappingConflict": false
  }
]
